{
  "$schema": "https://json-schema.org/draft/2020-12/schema",
  "$id": "https://codebuddy.local/evals/case.schema.json",
  "title": "Eval case",
  "description": "One snippet the buddy is asked about, and what a good answer must and must not contain. Scored by `buddy eval` (brain/src/buddy/evals.py).",
  "type": "object",
  "additionalProperties": false,
  "required": ["id", "title", "kind", "line", "code", "concepts", "forbidden", "rubric"],
  "properties": {
    "id": {"type": "string", "pattern": "^[a-z0-9]+(-[a-z0-9]+)*$", "description": "Same as the file name without .json."},
    "title": {"type": "string", "minLength": 3},
    "kind": {"enum": ["hint", "#?", "#!teoria"], "description": "hint: the student paused (idle, local engine). #? and #!teoria: explicit triggers (Claude)."},
    "line": {"type": "integer", "minimum": 1, "description": "1-based cursor line. For #? and #!teoria it holds the trigger comment."},
    "code": {"type": "string", "minLength": 1, "description": "The whole file, as the student has it."},
    "language": {"const": "italiano", "default": "italiano", "description": "The answer language the brain is asked for."},
    "concepts": {
      "type": "object",
      "minProperties": 1,
      "description": "Concept tag → regexes (case-insensitive). The answer must match at least one regex of at least one tag.",
      "additionalProperties": {"type": "array", "minItems": 1, "items": {"type": "string", "minLength": 1}}
    },
    "forbidden": {
      "type": "array",
      "description": "Regexes (case-insensitive) that give the fix away. None may match the answer.",
      "items": {"type": "string", "minLength": 1}
    },
    "fix_lines": {
      "type": "array",
      "description": "The corrected line(s). No answer line may contain one (whitespace and backticks ignored).",
      "items": {"type": "string", "minLength": 3}
    },
    "rubric": {"type": "string", "minLength": 10, "description": "What a good answer does, for the LLM judge and for humans."}
  }
}
